"ID","Gemeinde_color","Ja_Stimmen_In_Prozent","Nein_Stimmen_In_Prozent","Gemeinde_de","Text_de"
3101,15.3,15.3,84.7,"Appenzell AI","84,7 Prozent der Stimmbürgerinnen und Stimmbürger von Appenzell sagen Nein zur Änderung des Mietrechts zur vereinfachten Kündigung für Eigenbedarf. Appenzell hat damit gleich wie der Kanton Appenzell Innerrhoden Nein gesagt zu dieser Vorlage."
3102,53.3,53.3,46.7,"Gonten AI","53,3 Prozent der Abstimmenden in der Gemeinde Gonten haben Ja gesagt zur Änderung des Mietrechts zur vereinfachten Kündigung für Eigenbedarf. Gonten hat damit bei dieser Vorlage den höchsten Ja-Anteil im Kanton Appenzell Innerrhoden."
3104,3.1,3.1,96.9,"Schlatt-Haslen AI","In Schlatt-Haslen hat die Stimmbevölkerung die Änderung des Mietrechts zur vereinfachten Kündigung für Eigenbedarf abgelehnt. Die Vorlage wurde mit einem Nein-Stimmen-Anteil von 96,9 Prozent verworfen. Schlatt-Haslen hat damit bei dieser Vorlage den höchsten Nein-Anteil im Kanton Appenzell Innerrhoden."
3111,20.5,20.5,79.5,"Oberegg AI","In Oberegg hat die Stimmbevölkerung die Änderung des Mietrechts zur vereinfachten Kündigung für Eigenbedarf abgelehnt. Die Vorlage wurde mit einem Nein-Stimmen-Anteil von 79,5 Prozent verworfen. Oberegg hat damit gleich wie der Kanton Appenzell Innerrhoden Nein gesagt zu dieser Vorlage."
3112,52.2,52.2,47.8,"Schwende-Rüti AI","Ja zur Änderung des Mietrechts zur vereinfachten Kündigung für Eigenbedarf in Schwende-Rüti. Die Gemeinde hat die Vorlage mit 52,2 Prozent der Stimmen angenommen. Schwende-Rüti hat damit anders abgestimmt als der Kanton Appenzell Innerrhoden, der die Vorlage abgelehnt hat."
