"ID","Gemeinde_color","Ja_Stimmen_In_Prozent","Nein_Stimmen_In_Prozent","Gemeinde_de","Text_de"
3101,87.9,87.9,12.1,"Appenzell AI","Mit 6'792 Ja zu 933 Nein hat sich Appenzell für die einheitliche Finanzierung der Leistungen im Gesundheitswesen ausgesprochen. Das entspricht 87,9 Prozent. Appenzell hat damit bei dieser Vorlage den höchsten Ja-Anteil im Kanton Appenzell Innerrhoden."
3102,56.7,56.7,43.3,"Gonten AI","56,7 Prozent der Stimmbürgerinnen und Stimmbürger in Gonten haben Ja gesagt zur einheitliche Finanzierung der Leistungen im Gesundheitswesen. Gonten hat damit anders abgestimmt als der Kanton Appenzell Innerrhoden, der die Vorlage abgelehnt hat."
3104,72.5,72.5,27.5,"Schlatt-Haslen AI","Die einheitliche Finanzierung der Leistungen im Gesundheitswesen ist in Schlatt-Haslen mit 72,5 Prozent der Stimmen angenommen worden. Schlatt-Haslen hat damit anders abgestimmt als der Kanton Appenzell Innerrhoden, der die Vorlage abgelehnt hat."
3111,32.1,32.1,67.9,"Oberegg AI","Mit 7'615 Nein zu 3'595 Ja haben die Stimmbürgerinnen und Stimmbürger von Oberegg die einheitliche Finanzierung der Leistungen im Gesundheitswesen abgelehnt. Das sind 67,9 Prozent. Oberegg hat damit bei dieser Vorlage den höchsten Nein-Anteil im Kanton Appenzell Innerrhoden."
3112,49.1,49.1,50.9,"Schwende-Rüti AI","Schwende-Rüti hat die einheitliche Finanzierung der Leistungen im Gesundheitswesen mit 50,9 Prozent Nein-Stimmen verworfen. Schwende-Rüti hat damit gleich wie der Kanton Appenzell Innerrhoden Nein gesagt zu dieser Vorlage."
