"ID","Gemeinde_color","Ja_Stimmen_In_Prozent","Nein_Stimmen_In_Prozent","Gemeinde_de","Text_de"
3101,73.5,73.5,26.5,"Appenzell AI","Ja zum Bundesbeschluss über den Ausbau der Autobahnen in Appenzell: Mit 73,5 Prozent haben die Stimmbürgerinnen und Stimmbürger die Vorlage angenommen. Appenzell hat damit bei dieser Vorlage den höchsten Ja-Anteil im Kanton Appenzell Innerrhoden."
3102,66.9,66.9,33.1,"Gonten AI","66,9 Prozent der Abstimmenden in der Gemeinde Gonten haben Ja gesagt zum Bundesbeschluss über den Ausbau der Autobahnen. Gonten hat damit anders abgestimmt als der Kanton Appenzell Innerrhoden, der die Vorlage abgelehnt hat."
3104,0.2,0.2,99.8,"Schlatt-Haslen AI","Die Gemeinde Schlatt-Haslen hat den Bundesbeschluss über den Ausbau der Autobahnen mit dem dritthöchsten Nein-Anteil in der ganzen Schweiz abgelehnt: 99,8 Prozent legten ein Nein in die Urne. Schlatt-Haslen hat damit bei dieser Vorlage den höchsten Nein-Anteil im Kanton Appenzell Innerrhoden."
3111,33.6,33.6,66.4,"Oberegg AI","In Oberegg hat die Stimmbevölkerung den Bundesbeschluss über den Ausbau der Autobahnen abgelehnt. Die Vorlage wurde mit einem Nein-Stimmen-Anteil von 66,4 Prozent verworfen. Oberegg hat damit gleich wie der Kanton Appenzell Innerrhoden Nein gesagt zu dieser Vorlage."
3112,47.1,47.1,52.9,"Schwende-Rüti AI","Schwende-Rüti hat den Bundesbeschluss über den Ausbau der Autobahnen mit 52,9 Prozent abgelehnt. Schwende-Rüti hat damit gleich wie der Kanton Appenzell Innerrhoden Nein gesagt zu dieser Vorlage."
