"ID","Gemeinde_color","Ja_Stimmen_In_Prozent","Nein_Stimmen_In_Prozent","Gemeinde_de","Text_de"
1401,12.5,12.5,87.5,"Alpnach OW","Alpnach hat die Änderung des Mietrechts bei Untermiete mit 87,5 Prozent Nein-Stimmen verworfen. Alpnach hat damit anders abgestimmt als der Kanton Obwalden, der die Vorlage angenommen hat."
1402,47.1,47.1,52.9,"Engelberg OW","Mit 7'721 Nein zu 6'875 Ja haben die Stimmbürgerinnen und Stimmbürger von Engelberg die Änderung des Mietrechts bei Untermiete abgelehnt. Das sind 52,9 Prozent. Engelberg hat damit anders abgestimmt als der Kanton Obwalden, der die Vorlage angenommen hat."
1403,91.9,91.9,8.1,"Giswil OW","Die Änderung des Mietrechts bei Untermiete ist in Giswil mit 91,9 Prozent der Stimmen angenommen worden. Giswil hat damit bei dieser Vorlage den höchsten Ja-Anteil im Kanton Obwalden."
1404,12.1,12.1,87.9,"Kerns OW","In Kerns ist die Änderung des Mietrechts bei Untermiete mit 87,9 Prozent gescheitert. Kerns hat damit bei dieser Vorlage den höchsten Nein-Anteil im Kanton Obwalden."
1405,59.6,59.6,40.4,"Lungern OW","59,6 Prozent der Stimmbürgerinnen und Stimmbürger in Lungern haben Ja gesagt zur Pensionskassenreform. Lungern hat damit gleich wie der Kanton Obwalden Ja gesagt zu dieser Vorlage."
1406,79,79,21,"Sachseln OW","Sachseln hat die Änderung des Mietrechts bei Untermiete angenommen. Die Gemeinde stimmte der Vorlage mit Ja-Stimmen-Anteil von 79 Prozent zu. Sachseln hat damit gleich wie der Kanton Obwalden Ja gesagt zu dieser Vorlage."
1407,81.5,81.5,18.5,"Sarnen OW","Mit 81,5 Prozent Ja-Stimmen hat eine Mehrheit der Abstimmenden in Sarnen für die Änderung des Mietrechts bei Untermiete gestimmt. Sarnen hat damit gleich wie der Kanton Obwalden Ja gesagt zu dieser Vorlage."
